{
  "decision_kind": "repo_health_gate_decision",
  "schema_version": "0.1-draft",
  "subject": {
    "repo": "<repo>",
    "commit": null,
    "tree_hash": null,
    "binding_kind": "path_bound"
  },
  "verdict": "quarantine",
  "execution_authorized": false,
  "confidence": "medium",
  "confidence_reason": "no_finding_not_safety_proof:v3-check-0-readme; low_trust_no_finding:v3-check-0-readme; medium_limitation:missing_evidence_must_not_become_confidence; no_finding_not_safety_proof:v3-check-1-license; low_trust_no_finding:v3-check-1-license; no_finding_not_safety_proof:v3-check-2-gitignore; low_trust_no_finding:v3-check-2-gitignore; no_finding_not_safety_proof:v3-check-3-ci; low_trust_no_finding:v3-check-3-ci; no_finding_not_safety_proof:v3-check-4-tests; low_trust_no_finding:v3-check-4-tests; no_finding_not_safety_proof:v3-check-5-docs; low_trust_no_finding:v3-check-5-docs; no_finding_not_safety_proof:v3-check-6-scripts; low_trust_no_finding:v3-check-6-scripts; no_finding_not_safety_proof:v3-check-7-secrets_scan; low_trust_no_finding:v3-check-7-secrets_scan; no_finding_not_safety_proof:v3-check-8-large_files; low_trust_no_finding:v3-check-8-large_files; no_finding_not_safety_proof:v3-check-9-public_text_safety; low_trust_no_finding:v3-check-9-public_text_safety; no_finding_not_safety_proof:v3-check-10-tracked_artifacts; low_trust_no_finding:v3-check-10-tracked_artifacts; recommended_quarantine:static-supply-chain-shape; quarantine_signal:static-supply-chain-shape; missing_evidence",
  "explanation": {
    "summary": "The static health report may pass, but the repository contains supply-chain risk signals that prevent execution authorization.",
    "key_reasons": [
      "A package install hook or postinstall-like script is present.",
      "Credential-path or environment-access patterns are present.",
      "An outbound network target or network-attempt string is present.",
      "Workflow write-risk or GitHub Actions token-abuse-like behavior is present.",
      "Obfuscation or dynamic eval-like code is present.",
      "Scanner silence is not enough to authorize execution."
    ],
    "next_actions": [
      "Do not run install scripts locally.",
      "Review the install script and workflow changes.",
      "Use a dedicated VM or stronger sandbox if execution is necessary."
    ]
  },
  "evidence_summary": {
    "findings_count": 6,
    "blocking_evidence": [],
    "warning_evidence": [
      "v3-check-0-readme",
      "v3-check-1-license",
      "v3-check-2-gitignore",
      "v3-check-3-ci",
      "v3-check-4-tests",
      "v3-check-5-docs",
      "v3-check-6-scripts",
      "v3-check-7-secrets_scan",
      "v3-check-8-large_files",
      "v3-check-9-public_text_safety",
      "v3-check-10-tracked_artifacts",
      "static-supply-chain-shape"
    ],
    "missing_evidence": [
      "v3_report_lacks_commit_binding",
      "v3_report_lacks_tree_hash",
      "v3_report_lacks_formal_confidence_model",
      "v3_report_lacks_structured_raw_handling",
      "v3_report_is_check_oriented_not_gate_evaluator"
    ],
    "degraded_observers": []
  },
  "required_actions": [
    "do not run locally",
    "use dedicated VM or isolation if execution is necessary"
  ],
  "limitations": [
    "not_execution_authorization",
    "allow_limited_is_not_safety_proof",
    "v3_report_candidate_only",
    "no_finding_is_not_safety_proof",
    "missing_evidence_must_not_become_confidence",
    "v3_check:readme",
    "no_finding_scoped_to_current_check_only",
    "v3_check:license",
    "v3_check:gitignore",
    "v3_check:ci",
    "v3_check:tests",
    "v3_check:docs",
    "v3_check:scripts",
    "v3_check:secrets_scan",
    "v3_check:large_files",
    "v3_check:public_text_safety",
    "v3_check:tracked_artifacts",
    "static shape only; not proof of malicious behavior",
    "raw output not retained"
  ],
  "policy": {
    "policy_version": "0.1",
    "fail_closed": true
  },
  "residual_risks": [
    "execution_authorization_not_implemented",
    "v3_report_does_not_prove_safety",
    "commit_and_tree_binding_missing",
    "supply_chain_static_shape",
    "install_script_execution",
    "package_lifecycle_hook",
    "postinstall",
    "environment_access_candidate",
    "credential_path_reference",
    "network_request",
    "network_target_string",
    "outbound_network_target",
    "obfuscation",
    "dynamic_eval",
    "eval_candidate",
    "workflow_modification",
    "pull_request_target_misuse",
    "untrusted_checkout",
    "broad_token_permission"
  ]
}
